,Ticker,CompanyName,Sector,SubIndustry,HQLocation,DateFirstAdded,CIK,FoundedYear,QuoteURL,WikiPage,EDGARURL,HQLocationWikiPage,SectorId,Sector,IndustryGroupId,IndustryGroup,IndustryId,Industry,SubIndustryId,SubIndustry,SubIndustryDescription
358,PH,Parker-Hannifin,Industrials,Industrial Machinery,"Cleveland, Ohio",1985-11-30,0000076334,1917,https://www.nyse.com/quote/XNYS:PH,/wiki/Parker-Hannifin,https://www.sec.gov/cgi-bin/browse-edgar?CIK=PH&action=getcompany,"/wiki/Cleveland,_Ohio",20,Industrials,2010,Capital Goods,201060,Machinery,20106020,Industrial Machinery,"Manufacturers of industrial machinery and industrial components. Includes companies that manufacture presses, machine tools, compressors, pollution control equipment, elevators, escalators, insulators, pumps, roller bearings and other metal fabrications."
359,PAYX,Paychex Inc.,Information Technology,Data Processing & Outsourced Services,"Penfield, New York",,0000723531,1971,http://www.nasdaq.com/symbol/payx,/wiki/Paychex_Inc.,https://www.sec.gov/cgi-bin/browse-edgar?CIK=PAYX&action=getcompany,"/wiki/Penfield,_New_York",45,Information Technology,4510,Software & Services,451020,IT Services,45102020,Data Processing & Outsourced Services,Providers of commercial electronic data processing and/or business process outsourcing services. Includes companies that provide services for back-office automation.
360,PAYC,Paycom,Information Technology,Application Software,"Oklahoma City, Oklahoma",2020-01-28,0001590955,1998,https://www.nyse.com/quote/XNYS:PAYC,/wiki/Paycom,https://www.sec.gov/cgi-bin/browse-edgar?CIK=PAYC&action=getcompany,"/wiki/Oklahoma_City,_Oklahoma",45,Information Technology,4510,Software & Services,451030,Software,45103010,Application Software,"Companies engaged in developing and producing software designed for specialized applications for the business or consumer market. Includes enterprise and technical software, as well as cloud-based software. Excludes companies classified in the Interactive Home Entertainment Sub-Industry. Also excludes companies producing systems or database management software classified in the Systems Software Sub-Industry."
361,PYPL,PayPal,Information Technology,Data Processing & Outsourced Services,"San Jose, California",2015-07-20,0001633917,1998,http://www.nasdaq.com/symbol/pypl,/wiki/PayPal,https://www.sec.gov/cgi-bin/browse-edgar?CIK=PYPL&action=getcompany,"/wiki/San_Jose,_California",45,Information Technology,4510,Software & Services,451020,IT Services,45102020,Data Processing & Outsourced Services,Providers of commercial electronic data processing and/or business process outsourcing services. Includes companies that provide services for back-office automation.
362,PNR,Pentair plc,Industrials,Industrial Machinery,"Worsley, UK",2012-10-01,0000077360,1966,https://www.nyse.com/quote/XNYS:PNR,/wiki/Pentair,https://www.sec.gov/cgi-bin/browse-edgar?CIK=PNR&action=getcompany,"/wiki/Worsley,_UK",20,Industrials,2010,Capital Goods,201060,Machinery,20106020,Industrial Machinery,"Manufacturers of industrial machinery and industrial components. Includes companies that manufacture presses, machine tools, compressors, pollution control equipment, elevators, escalators, insulators, pumps, roller bearings and other metal fabrications."
363,PBCT,People's United Financial,Financials,Thrifts & Mortgage Finance,"Bridgeport, Connecticut",2008-11-13,0001378946,1842,http://www.nasdaq.com/symbol/pbct,/wiki/People%27s_United_Financial,https://www.sec.gov/cgi-bin/browse-edgar?CIK=PBCT&action=getcompany,"/wiki/Bridgeport,_Connecticut",40,Financials,4010,Banks,401020,Thrifts & Mortgage Finance,40102010,Thrifts & Mortgage Finance,"Financial institutions providing mortgage and mortgage related services. These include financial institutions whose assets are primarily mortgage related, savings & loans, mortgage lending institutions, building societies and companies providing insurance to mortgage banks."
364,PEP,PepsiCo Inc.,Consumer Staples,Soft Drinks,"Purchase, New York",1957-03-04,0000077476,1898,http://www.nasdaq.com/symbol/pep,/wiki/PepsiCo_Inc.,https://www.sec.gov/cgi-bin/browse-edgar?CIK=PEP&action=getcompany,"/wiki/Purchase,_New_York",30,Consumer Staples,3020,"Food, Beverage & Tobacco",302010,Beverages,30201030,Soft Drinks,Producers of non-alcoholic beverages including mineral waters. Excludes producers of milk classified in the Packaged Foods Sub-Industry.
365,PKI,PerkinElmer,Health Care,Health Care Equipment,"Waltham, Massachusetts",1985-05-31,0000031791,1937,https://www.nyse.com/quote/XNYS:PKI,/wiki/PerkinElmer,https://www.sec.gov/cgi-bin/browse-edgar?CIK=PKI&action=getcompany,"/wiki/Waltham,_Massachusetts",35,Health Care,3510,Health Care Equipment & Services,351010,Health Care Equipment & Supplies,35101010,Health Care Equipment,"Manufacturers of health care equipment and devices. Includes medical instruments, drug delivery systems, cardiovascular & orthopedic devices, and diagnostic equipment."
366,PRGO,Perrigo,Health Care,Pharmaceuticals,"Dublin, Ireland",2011-12-19,0001585364,2013 (1887),https://www.nyse.com/quote/XNYS:PRGO,/wiki/Perrigo,https://www.sec.gov/cgi-bin/browse-edgar?CIK=PRGO&action=getcompany,"/wiki/Dublin,_Ireland",35,Health Care,3520,"Pharmaceuticals, Biotechnology & Life Sciences",352020,Pharmaceuticals,35202010,Pharmaceuticals,"Companies engaged in the research, development or production of pharmaceuticals. Includes veterinary drugs."
367,PFE,Pfizer Inc.,Health Care,Pharmaceuticals,"New York, New York",1957-03-04,0000078003,1849,https://www.nyse.com/quote/XNYS:PFE,/wiki/Pfizer_Inc.,https://www.sec.gov/cgi-bin/browse-edgar?CIK=PFE&action=getcompany,"/wiki/New_York,_New_York",35,Health Care,3520,"Pharmaceuticals, Biotechnology & Life Sciences",352020,Pharmaceuticals,35202010,Pharmaceuticals,"Companies engaged in the research, development or production of pharmaceuticals. Includes veterinary drugs."
368,PM,Philip Morris International,Consumer Staples,Tobacco,"New York, New York",2008-03-31,0001413329,2008 (1847),https://www.nyse.com/quote/XNYS:PM,/wiki/Philip_Morris_International,https://www.sec.gov/cgi-bin/browse-edgar?CIK=PM&action=getcompany,"/wiki/New_York,_New_York",30,Consumer Staples,3020,"Food, Beverage & Tobacco",302030,Tobacco,30203010,Tobacco,Manufacturers of cigarettes and other tobacco products.
369,PSX,Phillips 66,Energy,Oil & Gas Refining & Marketing,"Houston, Texas",2012-05-01,0001534701,2012 (1917),https://www.nyse.com/quote/XNYS:PSX,/wiki/Phillips_66,https://www.sec.gov/cgi-bin/browse-edgar?CIK=PSX&action=getcompany,"/wiki/Houston,_Texas",10,Energy,1010,Energy,101020,"Oil, Gas & Consumable Fuels",10102030,Oil & Gas Refining & Marketing,"Companies engaged in the refining and marketing of oil, gas and/or refined products not classified in the Integrated Oil & Gas or Independent Power Producers & Energy Traders Sub-Industries."
370,PNW,Pinnacle West Capital,Utilities,Multi-Utilities,"Phoenix, Arizona",,0000764622,1985,https://www.nyse.com/quote/XNYS:PNW,/wiki/Pinnacle_West_Capital,https://www.sec.gov/cgi-bin/browse-edgar?CIK=PNW&action=getcompany,"/wiki/Phoenix,_Arizona",55,Utilities,5510,Utilities,551030,Multi-Utilities,55103010,Multi-Utilities,"Utility companies with significantly diversified activities in addition to core Electric Utility, Gas Utility and/or Water Utility operations."
371,PXD,Pioneer Natural Resources,Energy,Oil & Gas Exploration & Production,"Irving, Texas",2008-09-24,0001038357,1997,https://www.nyse.com/quote/XNYS:PXD,/wiki/Pioneer_Natural_Resources,https://www.sec.gov/cgi-bin/browse-edgar?CIK=PXD&action=getcompany,"/wiki/Irving,_Texas",10,Energy,1010,Energy,101020,"Oil, Gas & Consumable Fuels",10102020,Oil & Gas Exploration & Production,Companies engaged in the exploration and production of oil and gas not classified elsewhere.
372,PNC,PNC Financial Services,Financials,Regional Banks,"Pittsburgh, Pennsylvania",1988-04-30,0000713676,1845,https://www.nyse.com/quote/XNYS:PNC,/wiki/PNC_Financial_Services,https://www.sec.gov/cgi-bin/browse-edgar?CIK=PNC&action=getcompany,"/wiki/Pittsburgh,_Pennsylvania",40,Financials,4010,Banks,401010,Banks,40101015,Regional Banks,Commercial banks whose businesses are derived primarily from conventional banking operations and have significant business activity in retail banking and small and medium corporate lending. Regional banks tend to operate in limited geographic regions. Excludes companies classified in the Diversified Banks and Thrifts & Mortgage Banks sub-industries. Also excludes investment banks classified in the Investment Banking & Brokerage Sub-Industry.
373,POOL,Pool Corporation,Consumer Discretionary,Distributors,"Covington, Louisiana",2020-10-07,0000945841,1993,http://www.nasdaq.com/symbol/pool,/w/index.php?title=Pool_Corporation&action=edit&redlink=1,https://www.sec.gov/cgi-bin/browse-edgar?CIK=POOL&action=getcompany,"/wiki/Covington,_Louisiana",25,Consumer Discretionary,2550,Retailing,255010,Distributors,25501010,Distributors,Distributors and wholesalers of general merchandise not classified elsewhere. Includes vehicle distributors.
374,PPG,PPG Industries,Materials,Specialty Chemicals,"Pittsburgh, Pennsylvania",1957-03-04,0000079879,1883,https://www.nyse.com/quote/XNYS:PPG,/wiki/PPG_Industries,https://www.sec.gov/cgi-bin/browse-edgar?CIK=PPG&action=getcompany,"/wiki/Pittsburgh,_Pennsylvania",15,Materials,1510,Materials,151010,Chemicals,15101050,Specialty Chemicals,"Companies that primarily produce high value-added chemicals used in the manufacture of a wide variety of products, including but not limited to fine chemicals, additives, advanced polymers, adhesives, sealants and specialty paints, pigments and coatings."
375,PPL,PPL Corp.,Utilities,Electric Utilities,"Allentown, Pennsylvania",,0000922224,1920,https://www.nyse.com/quote/XNYS:PPL,/wiki/PPL_Corp.,https://www.sec.gov/cgi-bin/browse-edgar?CIK=PPL&action=getcompany,"/wiki/Allentown,_Pennsylvania",55,Utilities,5510,Utilities,551010,Electric Utilities,55101010,Electric Utilities,Companies that produce or distribute electricity. Includes both nuclear and non-nuclear facilities.
376,PFG,Principal Financial Group,Financials,Life & Health Insurance,"Des Moines, Iowa",2002-07-22,0001126328,1879,https://www.nyse.com/quote/XNYS:PFG,/wiki/Principal_Financial_Group,https://www.sec.gov/cgi-bin/browse-edgar?CIK=PFG&action=getcompany,"/wiki/Des_Moines,_Iowa",40,Financials,4030,Insurance,403010,Insurance,40301020,Life & Health Insurance,"Companies providing primarily life, disability, indemnity or supplemental health insurance. Excludes managed care companies classified in the Managed Health Care Sub-Industry."
377,PG,Procter & Gamble,Consumer Staples,Personal Products,"Cincinnati, Ohio",1957-03-04,0000080424,1837,https://www.nyse.com/quote/XNYS:PG,/wiki/Procter_%26_Gamble,https://www.sec.gov/cgi-bin/browse-edgar?CIK=PG&action=getcompany,"/wiki/Cincinnati,_Ohio",30,Consumer Staples,3030,Household & Personal Products,303020,Personal Products,30302010,Personal Products,"Manufacturers of personal and beauty care products, including cosmetics and perfumes."
378,PGR,Progressive Corp.,Financials,Property & Casualty Insurance,"Mayfield Village, Ohio",1997-08-04,0000080661,1937,https://www.nyse.com/quote/XNYS:PGR,/wiki/Progressive_Corp.,https://www.sec.gov/cgi-bin/browse-edgar?CIK=PGR&action=getcompany,"/wiki/Mayfield_Village,_Ohio",40,Financials,4030,Insurance,403010,Insurance,40301040,Property & Casualty Insurance,Companies providing primarily property and casualty insurance.
379,PLD,Prologis,Real Estate,Industrial REITs,"San Francisco, California",2003-07-17,0001045609,1983,https://www.nyse.com/quote/XNYS:PLD,/wiki/Prologis,https://www.sec.gov/cgi-bin/browse-edgar?CIK=PLD&action=getcompany,"/wiki/San_Francisco,_California",60,Real Estate,6010,Real Estate,601010,Equity Real Estate Investment Trusts (REITs),60101020,Industrial REITs,"Companies or Trusts engaged in the acquisition, development, ownership, leasing, management and operation of industrial properties. Includes companies operating industrial warehouses and distribution properties."
380,PRU,Prudential Financial,Financials,Life & Health Insurance,"Newark, New Jersey",2002-07-22,0001137774,1875,https://www.nyse.com/quote/XNYS:PRU,/wiki/Prudential_Financial,https://www.sec.gov/cgi-bin/browse-edgar?CIK=PRU&action=getcompany,"/wiki/Newark,_New_Jersey",40,Financials,4030,Insurance,403010,Insurance,40301020,Life & Health Insurance,"Companies providing primarily life, disability, indemnity or supplemental health insurance. Excludes managed care companies classified in the Managed Health Care Sub-Industry."
381,PEG,Public Service Enterprise Group (PSEG),Utilities,Electric Utilities,"Newark, New Jersey",1957-03-04,0000788784,1903,https://www.nyse.com/quote/XNYS:PEG,/wiki/Public_Service_Enterprise_Group,https://www.sec.gov/cgi-bin/browse-edgar?CIK=PEG&action=getcompany,"/wiki/Newark,_New_Jersey",55,Utilities,5510,Utilities,551010,Electric Utilities,55101010,Electric Utilities,Companies that produce or distribute electricity. Includes both nuclear and non-nuclear facilities.
382,PSA,Public Storage,Real Estate,Specialized REITs,"Glendale, California",2005-08-19,0001393311,1972,https://www.nyse.com/quote/XNYS:PSA,/wiki/Public_Storage,https://www.sec.gov/cgi-bin/browse-edgar?CIK=PSA&action=getcompany,"/wiki/Glendale,_California",60,Real Estate,6010,Real Estate,601010,Equity Real Estate Investment Trusts (REITs),60101080,Specialized REITs,"Companies or Trusts engaged in the acquisition, development, ownership, leasing, management and operation of properties not classified elsewhere. Includes trusts that operate and invest in storage properties. It also includes REITs that do not generate a majority of their revenues and income from real estate rental and leasing operations."
383,PHM,PulteGroup,Consumer Discretionary,Homebuilding,"Atlanta, Georgia",1984-04-30,0000822416,1956,https://www.nyse.com/quote/XNYS:PHM,/wiki/PulteGroup,https://www.sec.gov/cgi-bin/browse-edgar?CIK=PHM&action=getcompany,"/wiki/Atlanta,_Georgia",25,Consumer Discretionary,2520,Consumer Durables & Apparel,252010,Household Durables,25201030,Homebuilding,Residential construction companies. Includes manufacturers of prefabricated houses and semi-fixed manufactured homes.
384,PVH,PVH Corp.,Consumer Discretionary,"Apparel, Accessories & Luxury Goods","New York, New York",2013-02-15,0000078239,1881,https://www.nyse.com/quote/XNYS:PVH,/wiki/PVH_Corp.,https://www.sec.gov/cgi-bin/browse-edgar?CIK=PVH&action=getcompany,"/wiki/New_York,_New_York",25,Consumer Discretionary,2520,Consumer Durables & Apparel,252030,"Textiles, Apparel & Luxury Goods",25203010,"Apparel, Accessories & Luxury Goods","Manufacturers of apparel, accessories & luxury goods. Includes companies primarily producing designer handbags, wallets, luggage, jewelry and watches. Excludes shoes classified in the Footwear Sub-Industry."
385,QRVO,Qorvo,Information Technology,Semiconductors,"Greensboro, North Carolina",2015-06-11,0001604778,2015,http://www.nasdaq.com/symbol/qrvo,/wiki/Qorvo,https://www.sec.gov/cgi-bin/browse-edgar?CIK=QRVO&action=getcompany,"/wiki/Greensboro,_North_Carolina",45,Information Technology,4530,Semiconductors & Semiconductor Equipment,453010,Semiconductors & Semiconductor Equipment,45301020,Semiconductors,"Manufacturers of semiconductors and related products, including manufacturers of solar modules and cells."
386,PWR,Quanta Services Inc.,Industrials,Construction & Engineering,"Houston, Texas",2009-07-01,0001050915,1997,https://www.nyse.com/quote/XNYS:PWR,/wiki/Quanta_Services_Inc.,https://www.sec.gov/cgi-bin/browse-edgar?CIK=PWR&action=getcompany,"/wiki/Houston,_Texas",20,Industrials,2010,Capital Goods,201030,Construction & Engineering,20103010,Construction & Engineering,Companies engaged in primarily non-residential construction. Includes civil engineering companies and large-scale contractors. Excludes companies classified in the Homebuilding Sub-Industry.
387,QCOM,QUALCOMM Inc.,Information Technology,Semiconductors,"San Diego, California",,0000804328,1985,http://www.nasdaq.com/symbol/qcom,/wiki/QUALCOMM_Inc.,https://www.sec.gov/cgi-bin/browse-edgar?CIK=QCOM&action=getcompany,"/wiki/San_Diego,_California",45,Information Technology,4530,Semiconductors & Semiconductor Equipment,453010,Semiconductors & Semiconductor Equipment,45301020,Semiconductors,"Manufacturers of semiconductors and related products, including manufacturers of solar modules and cells."
388,DGX,Quest Diagnostics,Health Care,Health Care Services,"Secaucus, New Jersey",2002-12-12,0001022079,1967,https://www.nyse.com/quote/XNYS:DGX,/wiki/Quest_Diagnostics,https://www.sec.gov/cgi-bin/browse-edgar?CIK=DGX&action=getcompany,"/wiki/Secaucus,_New_Jersey",35,Health Care,3510,Health Care Equipment & Services,351020,Health Care Providers & Services,35102015,Health Care Services,"Providers of patient health care services not classified elsewhere. Includes dialysis centers, lab testing services, and pharmacy management services. Also includes companies providing business support services to health care providers, such as clerical support services, collection agency services, staffing services and outsourced sales & marketing services"
389,RL,Ralph Lauren Corporation,Consumer Discretionary,"Apparel, Accessories & Luxury Goods","New York, New York",2007-02-02,0001037038,1967,https://www.nyse.com/quote/XNYS:RL,/wiki/Ralph_Lauren_Corporation,https://www.sec.gov/cgi-bin/browse-edgar?CIK=RL&action=getcompany,"/wiki/New_York,_New_York",25,Consumer Discretionary,2520,Consumer Durables & Apparel,252030,"Textiles, Apparel & Luxury Goods",25203010,"Apparel, Accessories & Luxury Goods","Manufacturers of apparel, accessories & luxury goods. Includes companies primarily producing designer handbags, wallets, luggage, jewelry and watches. Excludes shoes classified in the Footwear Sub-Industry."
390,RJF,"Raymond James Financial, Inc.",Financials,Investment Banking & Brokerage,"St. Petersburg, Florida",2017-03-20,0000720005,1962,https://www.nyse.com/quote/XNYS:RJF,"/wiki/Raymond_James_Financial,_Inc.",https://www.sec.gov/cgi-bin/browse-edgar?CIK=RJF&action=getcompany,"/wiki/St._Petersburg,_Florida",40,Financials,4020,Diversified Financials,402030,Capital Markets,40203020,Investment Banking & Brokerage,"Financial institutions primarily engaged in investment banking & brokerage services, including equity and debt underwriting, mergers and acquisitions, securities lending and advisory services. Excludes banks and other financial institutions primarily involved in commercial lending, asset management and specialized financial activities."
391,RTX,Raytheon Technologies,Industrials,Aerospace & Defense,"Waltham, Massachusetts",,0000101829,1922,https://www.nyse.com/quote/XNYS:RTX,/wiki/Raytheon_Technologies,https://www.sec.gov/cgi-bin/browse-edgar?CIK=RTX&action=getcompany,"/wiki/Waltham,_Massachusetts",20,Industrials,2010,Capital Goods,201010,Aerospace & Defense,20101010,Aerospace & Defense,"Manufacturers of civil or military aerospace and defense equipment, parts or products. Includes defense electronics and space equipment."
392,O,Realty Income Corporation,Real Estate,Retail REITs,"San Diego, California",2015-04-07,0000726728,1969,https://www.nyse.com/quote/XNYS:O,/wiki/Realty_Income_Corporation,https://www.sec.gov/cgi-bin/browse-edgar?CIK=O&action=getcompany,"/wiki/San_Diego,_California",60,Real Estate,6010,Real Estate,601010,Equity Real Estate Investment Trusts (REITs),60101070,Retail REITs,"Companies or Trusts engaged in the acquisition, development, ownership, leasing, management and operation of shopping malls, outlet malls, neighborhood and community shopping centers."
393,REG,Regency Centers Corporation,Real Estate,Retail REITs,"Jacksonville, Florida",2017-03-02,0000910606,1963,https://www.nyse.com/quote/XNYS:REG,/wiki/Regency_Centers_Corporation,https://www.sec.gov/cgi-bin/browse-edgar?CIK=REG&action=getcompany,"/wiki/Jacksonville,_Florida",60,Real Estate,6010,Real Estate,601010,Equity Real Estate Investment Trusts (REITs),60101070,Retail REITs,"Companies or Trusts engaged in the acquisition, development, ownership, leasing, management and operation of shopping malls, outlet malls, neighborhood and community shopping centers."
394,REGN,Regeneron Pharmaceuticals,Health Care,Biotechnology,"Tarrytown, New York",2013-05-01,0000872589,1988,http://www.nasdaq.com/symbol/regn,/wiki/Regeneron_Pharmaceuticals,https://www.sec.gov/cgi-bin/browse-edgar?CIK=REGN&action=getcompany,"/wiki/Tarrytown,_New_York",35,Health Care,3520,"Pharmaceuticals, Biotechnology & Life Sciences",352010,Biotechnology,35201010,Biotechnology,"Companies primarily engaged in the research, development, manufacturing and/or marketing of products based on genetic analysis and genetic engineering. Includes companies specializing in protein-based therapeutics to treat human diseases. Excludes companies manufacturing products using biotechnology but without a health care application."
395,RF,Regions Financial Corp.,Financials,Regional Banks,"Birmingham, Alabama",1998-08-28,0001281761,1971,https://www.nyse.com/quote/XNYS:RF,/wiki/Regions_Financial_Corp.,https://www.sec.gov/cgi-bin/browse-edgar?CIK=RF&action=getcompany,"/wiki/Birmingham,_Alabama",40,Financials,4010,Banks,401010,Banks,40101015,Regional Banks,Commercial banks whose businesses are derived primarily from conventional banking operations and have significant business activity in retail banking and small and medium corporate lending. Regional banks tend to operate in limited geographic regions. Excludes companies classified in the Diversified Banks and Thrifts & Mortgage Banks sub-industries. Also excludes investment banks classified in the Investment Banking & Brokerage Sub-Industry.
396,RSG,Republic Services Inc,Industrials,Environmental & Facilities Services,"Phoenix, Arizona",2008-12-05,0001060391,1998 (1981),https://www.nyse.com/quote/XNYS:RSG,/wiki/Republic_Services_Inc,https://www.sec.gov/cgi-bin/browse-edgar?CIK=RSG&action=getcompany,"/wiki/Phoenix,_Arizona",20,Industrials,2020,Commercial & Professional Services,202010,Commercial Services & Supplies,20201050,Environmental & Facilities Services,"Companies providing environmental and facilities maintenance services. Includes waste management, facilities management and pollution control services. Excludes large-scale water treatment systems classified in the Water Utilities Sub-Industry."
397,RMD,ResMed,Health Care,Health Care Equipment,"San Diego, California",2017-07-26,0000943819,1989,https://www.nyse.com/quote/XNYS:RMD,/wiki/ResMed,https://www.sec.gov/cgi-bin/browse-edgar?CIK=RMD&action=getcompany,"/wiki/San_Diego,_California",35,Health Care,3510,Health Care Equipment & Services,351010,Health Care Equipment & Supplies,35101010,Health Care Equipment,"Manufacturers of health care equipment and devices. Includes medical instruments, drug delivery systems, cardiovascular & orthopedic devices, and diagnostic equipment."
398,RHI,Robert Half International,Industrials,Human Resource & Employment Services,"Menlo Park, California",2000-12-05,0000315213,1948,https://www.nyse.com/quote/XNYS:RHI,/wiki/Robert_Half_International,https://www.sec.gov/cgi-bin/browse-edgar?CIK=RHI&action=getcompany,"/wiki/Menlo_Park,_California",20,Industrials,2020,Commercial & Professional Services,202020,Professional Services,20202010,Human Resource & Employment Services,"Companies providing business support services relating to human capital management. Includes employment agencies, employee training, payroll & benefit support services, retirement support services and temporary agencies."
399,ROK,Rockwell Automation Inc.,Industrials,Electrical Components & Equipment,"Milwaukee, Wisconsin",,0001024478,1903,https://www.nyse.com/quote/XNYS:ROK,/wiki/Rockwell_Automation_Inc.,https://www.sec.gov/cgi-bin/browse-edgar?CIK=ROK&action=getcompany,"/wiki/Milwaukee,_Wisconsin",20,Industrials,2010,Capital Goods,201040,Electrical Equipment,20104010,Electrical Components & Equipment,"Companies that produce electric cables and wires, electrical components or equipment not classified in the Heavy Electrical Equipment Sub-Industry."
400,ROL,"Rollins, Inc.",Industrials,Environmental & Facilities Services,"Atlanta, Georgia",2018-10-01,0000084839,1948,https://www.nyse.com/quote/XNYS:ROL,"/wiki/Rollins,_Inc.",https://www.sec.gov/cgi-bin/browse-edgar?CIK=ROL&action=getcompany,"/wiki/Atlanta,_Georgia",20,Industrials,2020,Commercial & Professional Services,202010,Commercial Services & Supplies,20201050,Environmental & Facilities Services,"Companies providing environmental and facilities maintenance services. Includes waste management, facilities management and pollution control services. Excludes large-scale water treatment systems classified in the Water Utilities Sub-Industry."
401,ROP,Roper Technologies,Industrials,Industrial Conglomerates,"Sarasota, Florida",2009-12-23,0000882835,1981,https://www.nyse.com/quote/XNYS:ROP,/wiki/Roper_Technologies,https://www.sec.gov/cgi-bin/browse-edgar?CIK=ROP&action=getcompany,"/wiki/Sarasota,_Florida",20,Industrials,2010,Capital Goods,201050,Industrial Conglomerates,20105010,Industrial Conglomerates,"Diversified industrial companies with business activities in three or more sectors, none of which contributes a majority of revenues. Stakes held are predominantly of a controlling nature and stake holders maintain an operational interest in the running of the subsidiaries."
402,ROST,Ross Stores,Consumer Discretionary,Apparel Retail,"Dublin, California",2009-12-21,0000745732,1982,http://www.nasdaq.com/symbol/rost,/wiki/Ross_Stores,https://www.sec.gov/cgi-bin/browse-edgar?CIK=ROST&action=getcompany,"/wiki/Dublin,_California",25,Consumer Discretionary,2550,Retailing,255040,Specialty Retail,25504010,Apparel Retail,Retailers specialized mainly in apparel and accessories.
