,Ticker,CompanyName,Sector,SubIndustry,HQLocation,DateFirstAdded,CIK,FoundedYear,QuoteURL,WikiPage,EDGARURL,HQLocationWikiPage,SectorId,Sector,IndustryGroupId,IndustryGroup,IndustryId,Industry,SubIndustryId,SubIndustry,SubIndustryDescription
0,MMM,3M Company,Industrials,Industrial Conglomerates,"St. Paul, Minnesota",1976-08-09,0000066740,1902,https://www.nyse.com/quote/XNYS:MMM,/wiki/3M,https://www.sec.gov/cgi-bin/browse-edgar?CIK=MMM&action=getcompany,"/wiki/St._Paul,_Minnesota",20,Industrials,2010,Capital Goods,201050,Industrial Conglomerates,20105010,Industrial Conglomerates,"Diversified industrial companies with business activities in three or more sectors, none of which contributes a majority of revenues. Stakes held are predominantly of a controlling nature and stake holders maintain an operational interest in the running of the subsidiaries."
1,ABT,Abbott Laboratories,Health Care,Health Care Equipment,"North Chicago, Illinois",1964-03-31,0000001800,1888,https://www.nyse.com/quote/XNYS:ABT,/wiki/Abbott_Laboratories,https://www.sec.gov/cgi-bin/browse-edgar?CIK=ABT&action=getcompany,"/wiki/North_Chicago,_Illinois",35,Health Care,3510,Health Care Equipment & Services,351010,Health Care Equipment & Supplies,35101010,Health Care Equipment,"Manufacturers of health care equipment and devices. Includes medical instruments, drug delivery systems, cardiovascular & orthopedic devices, and diagnostic equipment."
2,ABBV,AbbVie Inc.,Health Care,Pharmaceuticals,"North Chicago, Illinois",2012-12-31,0001551152,2013 (1888),https://www.nyse.com/quote/XNYS:ABBV,/wiki/AbbVie_Inc.,https://www.sec.gov/cgi-bin/browse-edgar?CIK=ABBV&action=getcompany,"/wiki/North_Chicago,_Illinois",35,Health Care,3520,"Pharmaceuticals, Biotechnology & Life Sciences",352020,Pharmaceuticals,35202010,Pharmaceuticals,"Companies engaged in the research, development or production of pharmaceuticals. Includes veterinary drugs."
3,ABMD,ABIOMED Inc,Health Care,Health Care Equipment,"Danvers, Massachusetts",2018-05-31,0000815094,1981,http://www.nasdaq.com/symbol/abmd,/wiki/Abiomed,https://www.sec.gov/cgi-bin/browse-edgar?CIK=ABMD&action=getcompany,"/wiki/Danvers,_Massachusetts",35,Health Care,3510,Health Care Equipment & Services,351010,Health Care Equipment & Supplies,35101010,Health Care Equipment,"Manufacturers of health care equipment and devices. Includes medical instruments, drug delivery systems, cardiovascular & orthopedic devices, and diagnostic equipment."
4,ACN,Accenture plc,Information Technology,IT Consulting & Other Services,"Dublin, Ireland",2011-07-06,0001467373,1989,https://www.nyse.com/quote/XNYS:ACN,/wiki/Accenture_plc,https://www.sec.gov/cgi-bin/browse-edgar?CIK=ACN&action=getcompany,"/wiki/Dublin,_Ireland",45,Information Technology,4510,Software & Services,451020,IT Services,45102010,IT Consulting & Other Services,Providers of information technology and systems integration services not classified in the Data Processing & Outsourced Services Sub-Industry. Includes information technology consulting and information management services.
5,ATVI,Activision Blizzard,Communication Services,Interactive Home Entertainment,"Santa Monica, California",2015-08-31,0000718877,2008,http://www.nasdaq.com/symbol/atvi,/wiki/Activision_Blizzard,https://www.sec.gov/cgi-bin/browse-edgar?CIK=ATVI&action=getcompany,"/wiki/Santa_Monica,_California",50,Communication Services,5020,Media & Entertainment,502020,Entertainment,50202020,Interactive Home Entertainment,"Producers of interactive gaming products, including mobile gaming applications. Also includes educational software used primarily in the home. Excludes online gambling companies classified in the Casinos & Gaming Sub-Industry."
6,ADBE,Adobe Inc.,Information Technology,Application Software,"San Jose, California",1997-05-05,0000796343,1982,http://www.nasdaq.com/symbol/adbe,/wiki/Adobe_Inc.,https://www.sec.gov/cgi-bin/browse-edgar?CIK=ADBE&action=getcompany,"/wiki/San_Jose,_California",45,Information Technology,4510,Software & Services,451030,Software,45103010,Application Software,"Companies engaged in developing and producing software designed for specialized applications for the business or consumer market. Includes enterprise and technical software, as well as cloud-based software. Excludes companies classified in the Interactive Home Entertainment Sub-Industry. Also excludes companies producing systems or database management software classified in the Systems Software Sub-Industry."
7,AMD,Advanced Micro Devices Inc,Information Technology,Semiconductors,"Santa Clara, California",2017-03-20,0000002488,1969,http://www.nasdaq.com/symbol/amd,/wiki/Advanced_Micro_Devices_Inc,https://www.sec.gov/cgi-bin/browse-edgar?CIK=AMD&action=getcompany,"/wiki/Santa_Clara,_California",45,Information Technology,4530,Semiconductors & Semiconductor Equipment,453010,Semiconductors & Semiconductor Equipment,45301020,Semiconductors,"Manufacturers of semiconductors and related products, including manufacturers of solar modules and cells."
8,AAP,Advance Auto Parts,Consumer Discretionary,Automotive Retail,"Raleigh, North Carolina",2015-07-09,0001158449,1932,https://www.nyse.com/quote/XNYS:AAP,/wiki/Advance_Auto_Parts,https://www.sec.gov/cgi-bin/browse-edgar?CIK=AAP&action=getcompany,"/wiki/Raleigh,_North_Carolina",25,Consumer Discretionary,2550,Retailing,255040,Specialty Retail,25504050,Automotive Retail,"Owners and operators of stores specializing in automotive retail. Includes auto dealers, gas stations, and retailers of auto accessories, motorcycles & parts, automotive glass, and automotive equipment & parts."
9,AES,AES Corp,Utilities,Independent Power Producers & Energy Traders,"Arlington, Virginia",1998-10-02,0000874761,1981,https://www.nyse.com/quote/XNYS:AES,/wiki/AES_Corp,https://www.sec.gov/cgi-bin/browse-edgar?CIK=AES&action=getcompany,"/wiki/Arlington,_Virginia",55,Utilities,5510,Utilities,551050,Independent Power and Renewable Electricity Producers,55105010,Independent Power Producers & Energy Traders,"Companies that operate as Independent Power Producers (IPPs), Gas & Power Marketing & Trading Specialists and/or Integrated Energy Merchants. Excludes producers of electricity using renewable sources, such as solar power, hydropower, and wind power. Also excludes electric transmission companies and utility distribution companies classified in the Electric Utilities Sub-Industry."
10,AFL,AFLAC Inc,Financials,Life & Health Insurance,"Columbus, Georgia",1999-05-28,0000004977,1955,https://www.nyse.com/quote/XNYS:AFL,/wiki/AFLAC_Inc,https://www.sec.gov/cgi-bin/browse-edgar?CIK=AFL&action=getcompany,"/wiki/Columbus,_Georgia",40,Financials,4030,Insurance,403010,Insurance,40301020,Life & Health Insurance,"Companies providing primarily life, disability, indemnity or supplemental health insurance. Excludes managed care companies classified in the Managed Health Care Sub-Industry."
11,A,Agilent Technologies Inc,Health Care,Health Care Equipment,"Santa Clara, California",2000-06-05,0001090872,1999,https://www.nyse.com/quote/XNYS:A,/wiki/Agilent_Technologies_Inc,https://www.sec.gov/cgi-bin/browse-edgar?CIK=A&action=getcompany,"/wiki/Santa_Clara,_California",35,Health Care,3510,Health Care Equipment & Services,351010,Health Care Equipment & Supplies,35101010,Health Care Equipment,"Manufacturers of health care equipment and devices. Includes medical instruments, drug delivery systems, cardiovascular & orthopedic devices, and diagnostic equipment."
12,APD,Air Products & Chemicals Inc,Materials,Industrial Gases,"Allentown, Pennsylvania",1985-04-30,0000002969,1940,https://www.nyse.com/quote/XNYS:APD,/wiki/Air_Products_%26_Chemicals_Inc,https://www.sec.gov/cgi-bin/browse-edgar?CIK=APD&action=getcompany,"/wiki/Allentown,_Pennsylvania",15,Materials,1510,Materials,151010,Chemicals,15101040,Industrial Gases,Manufacturers of industrial gases.
13,AKAM,Akamai Technologies Inc,Information Technology,Internet Services & Infrastructure,"Cambridge, Massachusetts",2007-07-12,0001086222,1998,http://www.nasdaq.com/symbol/akam,/wiki/Akamai_Technologies_Inc,https://www.sec.gov/cgi-bin/browse-edgar?CIK=AKAM&action=getcompany,"/wiki/Cambridge,_Massachusetts",45,Information Technology,4510,Software & Services,451020,IT Services,45102030,Internet Services & Infrastructure,Companies providing services and infrastructure for the internet industry including data centers and cloud networking and storage infrastructure. Also includes companies providing web hosting services. Excludes companies classified in the Software Industry.
14,ALK,Alaska Air Group Inc,Industrials,Airlines,"Seattle, Washington",2016-05-13,0000766421,1985,https://www.nyse.com/quote/XNYS:ALK,/wiki/Alaska_Air_Group_Inc,https://www.sec.gov/cgi-bin/browse-edgar?CIK=ALK&action=getcompany,"/wiki/Seattle,_Washington",20,Industrials,2030,Transportation,203020,Airlines,20302010,Airlines,Companies providing primarily passenger air transportation.
15,ALB,Albemarle Corp,Materials,Specialty Chemicals,"Charlotte, North Carolina",2016-07-01,0000915913,1994,https://www.nyse.com/quote/XNYS:ALB,/wiki/Albemarle_Corp,https://www.sec.gov/cgi-bin/browse-edgar?CIK=ALB&action=getcompany,"/wiki/Charlotte,_North_Carolina",15,Materials,1510,Materials,151010,Chemicals,15101050,Specialty Chemicals,"Companies that primarily produce high value-added chemicals used in the manufacture of a wide variety of products, including but not limited to fine chemicals, additives, advanced polymers, adhesives, sealants and specialty paints, pigments and coatings."
16,ARE,Alexandria Real Estate Equities,Real Estate,Office REITs,"Pasadena, California",2017-03-20,0001035443,1994,https://www.nyse.com/quote/XNYS:ARE,/wiki/Alexandria_Real_Estate_Equities,https://www.sec.gov/cgi-bin/browse-edgar?CIK=ARE&action=getcompany,"/wiki/Pasadena,_California",60,Real Estate,6010,Real Estate,601010,Equity Real Estate Investment Trusts (REITs),60101040,Office REITs,"Companies or Trusts engaged in the acquisition, development, ownership, leasing, management and operation of office properties."
17,ALXN,Alexion Pharmaceuticals,Health Care,Pharmaceuticals,"Boston, Massachusetts",2012-05-25,0000899866,1992,http://www.nasdaq.com/symbol/alxn,/wiki/Alexion_Pharmaceuticals,https://www.sec.gov/cgi-bin/browse-edgar?CIK=ALXN&action=getcompany,"/wiki/Boston,_Massachusetts",35,Health Care,3520,"Pharmaceuticals, Biotechnology & Life Sciences",352020,Pharmaceuticals,35202010,Pharmaceuticals,"Companies engaged in the research, development or production of pharmaceuticals. Includes veterinary drugs."
18,ALGN,Align Technology,Health Care,Health Care Supplies,"San Jose, California",2017-06-19,0001097149,1997,http://www.nasdaq.com/symbol/algn,/wiki/Align_Technology,https://www.sec.gov/cgi-bin/browse-edgar?CIK=ALGN&action=getcompany,"/wiki/San_Jose,_California",35,Health Care,3510,Health Care Equipment & Services,351010,Health Care Equipment & Supplies,35101020,Health Care Supplies,"Manufacturers of health care supplies and medical products not classified elsewhere. Includes eye care products, hospital supplies, and safety needle & syringe devices."
19,ALLE,Allegion,Industrials,Building Products,"Dublin, Ireland",2013-12-02,0001579241,1908,https://www.nyse.com/quote/XNYS:ALLE,/wiki/Allegion,https://www.sec.gov/cgi-bin/browse-edgar?CIK=ALLE&action=getcompany,"/wiki/Dublin,_Ireland",20,Industrials,2010,Capital Goods,201020,Building Products,20102010,Building Products,Manufacturers of building components and home improvement products and equipment. Excludes lumber and plywood classified under Forest Products and cement and other materials classified in the Construction Materials Sub-Industry.
20,LNT,Alliant Energy Corp,Utilities,Electric Utilities,"Madison, Wisconsin",2016-07-01,0000352541,1917,https://www.nyse.com/quote/XNYS:LNT,/wiki/Alliant_Energy_Corp,https://www.sec.gov/cgi-bin/browse-edgar?CIK=LNT&action=getcompany,"/wiki/Madison,_Wisconsin",55,Utilities,5510,Utilities,551010,Electric Utilities,55101010,Electric Utilities,Companies that produce or distribute electricity. Includes both nuclear and non-nuclear facilities.
21,ALL,Allstate Corp,Financials,Property & Casualty Insurance,"Northfield Township, Illinois",1995-07-13,0000899051,1931,https://www.nyse.com/quote/XNYS:ALL,/wiki/Allstate_Corp,https://www.sec.gov/cgi-bin/browse-edgar?CIK=ALL&action=getcompany,"/wiki/Northfield_Township,_Illinois",40,Financials,4030,Insurance,403010,Insurance,40301040,Property & Casualty Insurance,Companies providing primarily property and casualty insurance.
22,GOOGL,Alphabet Inc. (Class A),Communication Services,Interactive Media & Services,"Mountain View, California",2014-04-03,0001652044,1998,http://www.nasdaq.com/symbol/googl,/wiki/Alphabet_Inc.,https://www.sec.gov/cgi-bin/browse-edgar?CIK=GOOGL&action=getcompany,"/wiki/Mountain_View,_California",50,Communication Services,5020,Media & Entertainment,502030,Interactive Media & Services,50203010,Interactive Media & Services,"Companies engaging in content and information creation or distribution through proprietary platforms, where revenues are derived primarily through pay-per-click advertisements. Includes search engines, social media and networking platforms, online classifieds, and online review companies. Excludes companies operating online marketplaces classified in Internet & Direct Marketing Retail."
23,GOOG,Alphabet Inc. (Class C),Communication Services,Interactive Media & Services,"Mountain View, California",2006-04-03,0001652044,1998,http://www.nasdaq.com/symbol/goog,/wiki/Alphabet_Inc.,https://www.sec.gov/cgi-bin/browse-edgar?CIK=GOOG&action=getcompany,"/wiki/Mountain_View,_California",50,Communication Services,5020,Media & Entertainment,502030,Interactive Media & Services,50203010,Interactive Media & Services,"Companies engaging in content and information creation or distribution through proprietary platforms, where revenues are derived primarily through pay-per-click advertisements. Includes search engines, social media and networking platforms, online classifieds, and online review companies. Excludes companies operating online marketplaces classified in Internet & Direct Marketing Retail."
24,MO,Altria Group Inc,Consumer Staples,Tobacco,"Richmond, Virginia",1957-03-04,0000764180,1985,https://www.nyse.com/quote/XNYS:MO,/wiki/Altria_Group_Inc,https://www.sec.gov/cgi-bin/browse-edgar?CIK=MO&action=getcompany,"/wiki/Richmond,_Virginia",30,Consumer Staples,3020,"Food, Beverage & Tobacco",302030,Tobacco,30203010,Tobacco,Manufacturers of cigarettes and other tobacco products.
25,AMZN,Amazon.com Inc.,Consumer Discretionary,Internet & Direct Marketing Retail,"Seattle, Washington",2005-11-18,0001018724,1994,http://www.nasdaq.com/symbol/amzn,/wiki/Amazon.com_Inc.,https://www.sec.gov/cgi-bin/browse-edgar?CIK=AMZN&action=getcompany,"/wiki/Seattle,_Washington",25,Consumer Discretionary,2550,Retailing,255020,Internet & Direct Marketing Retail,25502020,Internet & Direct Marketing Retail,"Companies providing retail services primarily on the Internet, through mail order, and TV home shopping retailers. Also includes companies providing online marketplaces for consumer products and services."
26,AMCR,Amcor plc,Materials,Paper Packaging,"Warmley, Bristol, United Kingdom",2019-06-07,0001748790,2019 (1860),https://www.nyse.com/quote/XNYS:AMCR,/wiki/Amcor_plc,https://www.sec.gov/cgi-bin/browse-edgar?CIK=AMCR&action=getcompany,/wiki/Warmley,15,Materials,1510,Materials,151030,Containers & Packaging,15103020,Paper Packaging,Manufacturers of paper and cardboard containers and packaging.
27,AEE,Ameren Corp,Utilities,Multi-Utilities,"St. Louis, Missouri",1991-09-19,0001002910,1902,https://www.nyse.com/quote/XNYS:AEE,/wiki/Ameren_Corp,https://www.sec.gov/cgi-bin/browse-edgar?CIK=AEE&action=getcompany,"/wiki/St._Louis,_Missouri",55,Utilities,5510,Utilities,551030,Multi-Utilities,55103010,Multi-Utilities,"Utility companies with significantly diversified activities in addition to core Electric Utility, Gas Utility and/or Water Utility operations."
28,AAL,American Airlines Group,Industrials,Airlines,"Fort Worth, Texas",2015-03-23,0000006201,1934,http://www.nasdaq.com/symbol/aal,/wiki/American_Airlines_Group,https://www.sec.gov/cgi-bin/browse-edgar?CIK=AAL&action=getcompany,"/wiki/Fort_Worth,_Texas",20,Industrials,2030,Transportation,203020,Airlines,20302010,Airlines,Companies providing primarily passenger air transportation.
29,AEP,American Electric Power,Utilities,Electric Utilities,"Columbus, Ohio",1957-03-04,0000004904,1906,https://www.nyse.com/quote/XNYS:AEP,/wiki/American_Electric_Power,https://www.sec.gov/cgi-bin/browse-edgar?CIK=AEP&action=getcompany,"/wiki/Columbus,_Ohio",55,Utilities,5510,Utilities,551010,Electric Utilities,55101010,Electric Utilities,Companies that produce or distribute electricity. Includes both nuclear and non-nuclear facilities.
30,AXP,American Express Co,Financials,Consumer Finance,"New York, New York",1976-06-30,0000004962,1850,https://www.nyse.com/quote/XNYS:AXP,/wiki/American_Express_Co,https://www.sec.gov/cgi-bin/browse-edgar?CIK=AXP&action=getcompany,"/wiki/New_York,_New_York",40,Financials,4020,Diversified Financials,402020,Consumer Finance,40202010,Consumer Finance,"Providers of consumer finance services, including personal credit, credit cards, lease financing, travel-related money services and pawn shops. Excludes mortgage lenders classified in the Thrifts & Mortgage Finance Sub-Industry."
31,AIG,American International Group,Financials,Property & Casualty Insurance,"New York, New York",1980-03-31,0000005272,1919,https://www.nyse.com/quote/XNYS:AIG,/wiki/American_International_Group,https://www.sec.gov/cgi-bin/browse-edgar?CIK=AIG&action=getcompany,"/wiki/New_York,_New_York",40,Financials,4030,Insurance,403010,Insurance,40301040,Property & Casualty Insurance,Companies providing primarily property and casualty insurance.
32,AMT,American Tower Corp.,Real Estate,Specialized REITs,"Boston, Massachusetts",2007-11-19,0001053507,1995,https://www.nyse.com/quote/XNYS:AMT,/wiki/American_Tower_Corp.,https://www.sec.gov/cgi-bin/browse-edgar?CIK=AMT&action=getcompany,"/wiki/Boston,_Massachusetts",60,Real Estate,6010,Real Estate,601010,Equity Real Estate Investment Trusts (REITs),60101080,Specialized REITs,"Companies or Trusts engaged in the acquisition, development, ownership, leasing, management and operation of properties not classified elsewhere. Includes trusts that operate and invest in storage properties. It also includes REITs that do not generate a majority of their revenues and income from real estate rental and leasing operations."
33,AWK,American Water Works Company Inc,Utilities,Water Utilities,"Camden, New Jersey",2016-03-04,0001410636,1886,https://www.nyse.com/quote/XNYS:AWK,/wiki/American_Water_Works,https://www.sec.gov/cgi-bin/browse-edgar?CIK=AWK&action=getcompany,"/wiki/Camden,_New_Jersey",55,Utilities,5510,Utilities,551040,Water Utilities,55104010,Water Utilities,Companies that purchase and redistribute water to the end-consumer. Includes large-scale water treatment systems.
34,AMP,Ameriprise Financial,Financials,Asset Management & Custody Banks,"Minneapolis, Minnesota",2005-10-03,0000820027,1894,https://www.nyse.com/quote/XNYS:AMP,/wiki/Ameriprise_Financial,https://www.sec.gov/cgi-bin/browse-edgar?CIK=AMP&action=getcompany,"/wiki/Minneapolis,_Minnesota",40,Financials,4020,Diversified Financials,402030,Capital Markets,40203010,Asset Management & Custody Banks,"Financial institutions primarily engaged in investment management and/or related custody and securities fee-based services. Includes companies operating mutual funds, closed-end funds and unit investment trusts. Excludes banks and other financial institutions primarily involved in commercial lending, investment banking, brokerage and other specialized financial activities."
35,ABC,AmerisourceBergen Corp,Health Care,Health Care Distributors,"Chesterbrook, Pennsylvania",2001-08-30,0001140859,1985,https://www.nyse.com/quote/XNYS:ABC,/wiki/AmerisourceBergen_Corp,https://www.sec.gov/cgi-bin/browse-edgar?CIK=ABC&action=getcompany,"/wiki/Chesterbrook,_Pennsylvania",35,Health Care,3510,Health Care Equipment & Services,351020,Health Care Providers & Services,35102010,Health Care Distributors,Distributors and wholesalers of health care products not classified elsewhere.
36,AME,AMETEK Inc.,Industrials,Electrical Components & Equipment,"Berwyn, Pennsylvania",2013-09-23,0001037868,1930,https://www.nyse.com/quote/XNYS:AME,/wiki/AMETEK_Inc.,https://www.sec.gov/cgi-bin/browse-edgar?CIK=AME&action=getcompany,"/wiki/Berwyn,_Pennsylvania",20,Industrials,2010,Capital Goods,201040,Electrical Equipment,20104010,Electrical Components & Equipment,"Companies that produce electric cables and wires, electrical components or equipment not classified in the Heavy Electrical Equipment Sub-Industry."
37,AMGN,Amgen Inc.,Health Care,Biotechnology,"Thousand Oaks, California",1992-01-02,0000318154,1980,http://www.nasdaq.com/symbol/amgn,/wiki/Amgen_Inc.,https://www.sec.gov/cgi-bin/browse-edgar?CIK=AMGN&action=getcompany,"/wiki/Thousand_Oaks,_California",35,Health Care,3520,"Pharmaceuticals, Biotechnology & Life Sciences",352010,Biotechnology,35201010,Biotechnology,"Companies primarily engaged in the research, development, manufacturing and/or marketing of products based on genetic analysis and genetic engineering. Includes companies specializing in protein-based therapeutics to treat human diseases. Excludes companies manufacturing products using biotechnology but without a health care application."
38,APH,Amphenol Corp,Information Technology,Electronic Components,"Wallingford, Connecticut",2008-09-30,0000820313,1932,https://www.nyse.com/quote/XNYS:APH,/wiki/Amphenol_Corp,https://www.sec.gov/cgi-bin/browse-edgar?CIK=APH&action=getcompany,"/wiki/Wallingford,_Connecticut",45,Information Technology,4520,Technology Hardware & Equipment,452030,"Electronic Equipment, Instruments & Components",45203015,Electronic Components,"Manufacturers of electronic components. Includes electronic components, connection devices, electron tubes, electronic capacitors and resistors, electronic coil, printed circuit board, transformer and other inductors, signal processing technology/components."
39,ADI,"Analog Devices, Inc.",Information Technology,Semiconductors,"Norwood, Massachusetts",1999-10-12,0000006281,1965,http://www.nasdaq.com/symbol/adi,"/wiki/Analog_Devices,_Inc.",https://www.sec.gov/cgi-bin/browse-edgar?CIK=ADI&action=getcompany,"/wiki/Norwood,_Massachusetts",45,Information Technology,4530,Semiconductors & Semiconductor Equipment,453010,Semiconductors & Semiconductor Equipment,45301020,Semiconductors,"Manufacturers of semiconductors and related products, including manufacturers of solar modules and cells."
40,ANSS,"ANSYS, Inc.",Information Technology,Application Software,"Canonsburg, Pennsylvania",2017-06-19,0001013462,1969,http://www.nasdaq.com/symbol/anss,"/wiki/ANSYS,_Inc.",https://www.sec.gov/cgi-bin/browse-edgar?CIK=ANSS&action=getcompany,"/wiki/Canonsburg,_Pennsylvania",45,Information Technology,4510,Software & Services,451030,Software,45103010,Application Software,"Companies engaged in developing and producing software designed for specialized applications for the business or consumer market. Includes enterprise and technical software, as well as cloud-based software. Excludes companies classified in the Interactive Home Entertainment Sub-Industry. Also excludes companies producing systems or database management software classified in the Systems Software Sub-Industry."
41,ANTM,Anthem,Health Care,Managed Health Care,"Indianapolis, Indiana",2002-07-25,0001156039,2014 (1946),https://www.nyse.com/quote/XNYS:ANTM,/wiki/Anthem_(company),https://www.sec.gov/cgi-bin/browse-edgar?CIK=ANTM&action=getcompany,"/wiki/Indianapolis,_Indiana",35,Health Care,3510,Health Care Equipment & Services,351020,Health Care Providers & Services,35102030,Managed Health Care,Owners and operators of Health Maintenance Organizations (HMOs) and other managed plans.
42,AON,Aon plc,Financials,Insurance Brokers,"London, United Kingdom",1996-04-23,0000315293,1982 (1919),https://www.nyse.com/quote/XNYS:AON,/wiki/Aon_plc,https://www.sec.gov/cgi-bin/browse-edgar?CIK=AON&action=getcompany,/wiki/London,40,Financials,4030,Insurance,403010,Insurance,40301010,Insurance Brokers,Insurance and reinsurance brokerage firms.
43,AOS,A.O. Smith Corp,Industrials,Building Products,"Milwaukee, Wisconsin",2017-07-26,0000091142,1916,https://www.nyse.com/quote/XNYS:AOS,/wiki/A.O._Smith_Corp,https://www.sec.gov/cgi-bin/browse-edgar?CIK=AOS&action=getcompany,"/wiki/Milwaukee,_Wisconsin",20,Industrials,2010,Capital Goods,201020,Building Products,20102010,Building Products,Manufacturers of building components and home improvement products and equipment. Excludes lumber and plywood classified under Forest Products and cement and other materials classified in the Construction Materials Sub-Industry.
44,APA,Apache Corporation,Energy,Oil & Gas Exploration & Production,"Houston, Texas",1997-07-28,0000006769,1954,http://www.nasdaq.com/symbol/apa,/wiki/Apache_Corporation,https://www.sec.gov/cgi-bin/browse-edgar?CIK=APA&action=getcompany,"/wiki/Houston,_Texas",10,Energy,1010,Energy,101020,"Oil, Gas & Consumable Fuels",10102020,Oil & Gas Exploration & Production,Companies engaged in the exploration and production of oil and gas not classified elsewhere.
